{
  "accountId": "00000000011",
  "customer": {
    "firstName": "Immanuel",
    "lastName": "Kessler",
    "addressLines": ["618 Deshaun Route", "Apt. 802", "North Enoshaven NY USA 12345"]
  },
  "cardNumber": "**-**-****-5678",
  "currentBalance": 87.50,
  "ficoScore": 688,
  "transactions": [
    {"transactionId": "0000000000683590", "description": "Annual card fee", "amount": -95.00},
    {"transactionId": "0000000000683591", "description": "Refund from merchant", "amount": -12.50}
  ],
  "totalAmount": -107.50
}
