{
  "accountId": "00000000011",
  "customer": {
    "firstName": "Immanuel",
    "lastName": "Kessler",
    "addressLines": ["618 Deshaun Route", "Apt. 802", "North Enoshaven NY USA 12345"]
  },
  "cardNumber": "**-**-****-1234",
  "currentBalance": 194.00,
  "ficoScore": 688,
  "transactions": [
    {"transactionId": "0000000000683580", "description": "Purchase at Abshire-Lowe", "amount": -123.45},
    {"transactionId": "0000000000683581", "description": "Payment received", "amount": 250.00}
  ],
  "totalAmount": 126.55
}
